<?xml version="1.0" encoding="UTF-8"?>

<!-- Se volessimo validare il file XML con il file DTD esterno -->
<!-- <!DOCTYPE palinsesto SYSTEM "palinsesto.dtd"> -->
<!-- Non dovremmo inserire la parte "xmlns" nel tag "palinsesto" -->

<palinsesto xmlns:xsi="http://www.w3.org/2001/XMLSchema-instance"
            xsi:noNamespaceSchemaLocation="palinsesto.xsd">
  <cartellone>
    <fileHTML>CocaCola.html</fileHTML>
    <durata>12</durata> <!-- Durata in secondi -->
  </cartellone>
  <cartellone>
    <fileHTML>NaturaSi.html</fileHTML>
    <durata>10</durata>
  </cartellone>
  <cartellone>
    <fileHTML>Vespa.html</fileHTML>
    <durata>10</durata>
  </cartellone>
</palinsesto>
