<?xml version="1.0" encoding="UTF-8"?>

<!-- Se volessimo validare il file XML con il file DTD esterno -->
<!-- <!DOCTYPE palinsesto SYSTEM "palinsesto.dtd"> -->
<!-- Non dovremmo inserire la parte "xmlns" nel tag "palinsesto" -->

<palinsesto xmlns:xsi="http://www.w3.org/2001/XMLSchema-instance"
          xsi:noNamespaceSchemaLocation="palinsesto.xsd">

    <cartellone>
        <fileHTML>nissan.html</fileHTML>    <!-- Nome del file da richiedere al server -->
        <durata>8</durata>  <!-- Durata in secondi -->
    </cartellone>

    <cartellone>
        <fileHTML>notebook.html</fileHTML>
        <durata>8</durata>
    </cartellone>

    <cartellone>
        <fileHTML>festival.html</fileHTML>
        <durata>9</durata>
    </cartellone>

    <cartellone>
        <fileHTML>dentista.html</fileHTML>
        <durata>22</durata>
    </cartellone>

</palinsesto>